{
  "category": "syntax",
  "code": "RHO1009",
  "entity": null,
  "fixits": [
    {
      "applicability": "needs-review",
      "edits": [
        {
          "byte_end": 54,
          "byte_start": 48,
          "col_end": 18,
          "col_start": 12,
          "file": "designs/example.rhoform",
          "line_end": 3,
          "line_start": 3,
          "replacement": "passive"
        }
      ],
      "message": "did you mean `passive`?",
      "placeholders": []
    }
  ],
  "message": "`pasive` is not a pin_role; the closed vocabulary is checked after parsing (see CLOSED_VOCABULARIES).",
  "params": {
    "vocabulary": "pin_role",
    "word": "pasive"
  },
  "schema": "rhoform-diagnostic/0",
  "severity": "error",
  "slug": "not-in-closed-vocabulary",
  "spans": [
    {
      "byte_end": 54,
      "byte_start": 48,
      "col_end": 18,
      "col_start": 12,
      "file": "designs/example.rhoform",
      "label": null,
      "line_end": 3,
      "line_start": 3,
      "primary": true
    }
  ],
  "tier": null
}
